{
  "$schema": "http://json-schema.org/draft-07/schema#",
  "$id": "https://arc.dev/schema/routing-trace-sidecar.json",
  "title": "RoutingTraceSidecar",
  "type": "object",
  "required": [
    "contract",
    "schema",
    "timestamp",
    "status",
    "route",
    "models",
    "serving",
    "traversal",
    "failure",
    "authorization",
    "lineage",
    "worktree",
    "versions",
    "budgets",
    "legacy"
  ],
  "properties": {
    "contract": { "const": "orchestrator-routing-trace/v2" },
    "schema": { "const": 2 },
    "timestamp": { "type": "string", "minLength": 1 },
    "status": { "enum": ["completed", "blocked", "error"] },
    "route": {
      "type": "object",
      "required": ["requested_public_alias", "requested_alias_kind", "canonical_capability_route"],
      "properties": {
        "requested_public_alias": { "type": ["string", "null"] },
        "requested_alias_kind": { "enum": ["executable-route", "public-surface", null] },
        "canonical_capability_route": { "type": ["string", "null"] }
      },
      "additionalProperties": false
    },
    "models": {
      "type": "object",
      "required": ["requested", "candidate", "attempted", "selected"],
      "properties": {
        "requested": { "type": ["string", "null"] },
        "candidate": { "type": ["string", "null"] },
        "attempted": { "type": ["string", "null"] },
        "selected": { "type": ["string", "null"] }
      },
      "additionalProperties": false
    },
    "serving": {
      "type": "object",
      "required": [
        "provider",
        "provider_model_id",
        "transport_backend",
        "adapter_id",
        "adapter_version",
        "stable_id"
      ],
      "properties": {
        "provider": { "type": ["string", "null"] },
        "provider_model_id": { "type": ["string", "null"] },
        "transport_backend": { "type": ["string", "null"] },
        "adapter_id": { "type": ["string", "null"] },
        "adapter_version": { "type": ["string", "null"] },
        "stable_id": { "type": ["string", "null"] }
      },
      "additionalProperties": false
    },
    "traversal": {
      "type": "object",
      "required": ["candidate_index", "attempt_index", "stack_size", "traversal_id"],
      "properties": {
        "candidate_index": { "type": ["integer", "null"], "minimum": 0 },
        "attempt_index": { "type": ["integer", "null"], "minimum": 0 },
        "stack_size": { "type": ["integer", "null"], "minimum": 0 },
        "traversal_id": { "type": ["string", "null"] }
      },
      "additionalProperties": false
    },
    "failure": {
      "type": "object",
      "required": [
        "normalized_class",
        "detail",
        "fallback_source",
        "fallback_destination",
        "fallback_reason",
        "terminal_reason"
      ],
      "properties": {
        "normalized_class": { "type": ["string", "null"] },
        "detail": { "type": ["string", "null"] },
        "fallback_source": { "type": ["string", "null"] },
        "fallback_destination": { "type": ["string", "null"] },
        "fallback_reason": { "type": ["string", "null"] },
        "terminal_reason": { "type": ["string", "null"] }
      },
      "additionalProperties": false
    },
    "authorization": {
      "type": "object",
      "required": [
        "override_requested",
        "override_applied",
        "explicit_parent_escalation",
        "sol_authorized"
      ],
      "properties": {
        "override_requested": { "type": "boolean" },
        "override_applied": { "type": "boolean" },
        "explicit_parent_escalation": { "type": "boolean" },
        "sol_authorized": { "type": "boolean" }
      },
      "additionalProperties": false
    },
    "lineage": {
      "type": "object",
      "required": ["root_run_id", "parent_run_id", "run_id", "task_id", "depth", "scheduler_id"],
      "properties": {
        "root_run_id": { "type": "string", "minLength": 1 },
        "parent_run_id": { "type": ["string", "null"] },
        "run_id": { "type": "string", "minLength": 1 },
        "task_id": { "type": ["string", "null"] },
        "depth": { "type": "integer", "minimum": 0 },
        "scheduler_id": { "type": ["string", "null"] }
      },
      "additionalProperties": false
    },
    "worktree": {
      "type": "object",
      "required": ["checkout_id"],
      "properties": {
        "checkout_id": { "type": "string", "minLength": 1 }
      },
      "additionalProperties": false
    },
    "versions": {
      "type": "object",
      "required": ["policy", "budget_policy", "registry", "capability_routes", "routing_shadow", "routing_trace"],
      "properties": {
        "policy": { "type": "string", "minLength": 1 },
        "budget_policy": { "type": "string", "minLength": 1 },
        "registry": { "type": "integer", "minimum": 0 },
        "capability_routes": { "type": "integer", "minimum": 0 },
        "routing_shadow": { "type": "integer", "minimum": 0 },
        "routing_trace": { "type": "integer", "minimum": 2 }
      },
      "additionalProperties": false
    },
    "budgets": {
      "type": "object",
      "required": ["root", "dispatch"],
      "properties": {
        "root": { "$ref": "#/$defs/budgetScope" },
        "dispatch": { "$ref": "#/$defs/budgetScope" }
      },
      "additionalProperties": false
    },
    "legacy": { "$ref": "#/$defs/legacySchema4" }
  },
  "additionalProperties": false,
  "$defs": {
    "budgetDimension": {
      "type": "object",
      "required": ["allocated", "consumed", "remaining"],
      "properties": {
        "allocated": { "type": ["number", "null"], "minimum": 0 },
        "consumed": { "type": "number", "minimum": 0 },
        "remaining": { "type": ["number", "null"] },
        "measurement": { "enum": ["known", "unknown"] }
      },
      "additionalProperties": false
    },
    "budgetScope": {
      "type": "object",
      "required": ["token", "wall_time_ms", "call", "cost", "concurrency"],
      "properties": {
        "token": { "$ref": "#/$defs/budgetDimension" },
        "wall_time_ms": { "$ref": "#/$defs/budgetDimension" },
        "call": { "$ref": "#/$defs/budgetDimension" },
        "cost": { "$ref": "#/$defs/budgetDimension" },
        "concurrency": { "$ref": "#/$defs/budgetDimension" }
      },
      "additionalProperties": false
    },
    "legacySchema4": {
      "type": "object",
      "required": [
        "schema",
        "run_id",
        "timestamp",
        "backend",
        "mode",
        "model",
        "sandbox",
        "project",
        "label",
        "task_class",
        "route_rationale",
        "duration_ms",
        "status",
        "exit_code",
        "changed_files",
        "tokens",
        "budget",
        "error"
      ],
      "properties": {
        "schema": { "const": 4 },
        "run_id": { "type": "string", "minLength": 1 },
        "timestamp": { "type": "string", "minLength": 1 },
        "backend": { "enum": ["codex", "composer", "claude"] },
        "mode": { "enum": ["analyze", "implement", "review"] },
        "model": { "type": "string", "minLength": 1 },
        "sandbox": { "enum": ["read-only", "workspace-write"] },
        "project": { "type": "string", "minLength": 1 },
        "label": { "type": ["string", "null"] },
        "task_class": { "type": ["string", "null"] },
        "route_rationale": { "type": ["string", "null"] },
        "duration_ms": { "type": "integer", "minimum": 0 },
        "status": { "enum": ["completed", "blocked", "error"] },
        "exit_code": { "type": "integer" },
        "changed_files": { "type": ["integer", "null"], "minimum": 0 },
        "tokens": {
          "oneOf": [
            { "type": "null" },
            {
              "type": "object",
              "required": ["input_tokens", "cached_input_tokens", "output_tokens", "total_tokens"],
              "properties": {
                "input_tokens": { "type": "integer", "minimum": 0 },
                "cached_input_tokens": { "type": ["integer", "null"], "minimum": 0 },
                "output_tokens": { "type": "integer", "minimum": 0 },
                "total_tokens": { "type": "integer", "minimum": 0 }
              },
              "additionalProperties": false
            }
          ]
        },
        "budget": {},
        "error": { "type": ["string", "null"] },
        "outcome": {
          "enum": ["accepted", "rejected", "blocked", "verification-failed", "escalated", null]
        },
        "effort": { "enum": ["none", "low", "medium", "high", "xhigh", "max"] },
        "failure_class": { "enum": ["backend_unavailable"] },
        "outage_reason": { "enum": ["usage_limit", "auth", "missing_binary"] },
        "fallback": {
          "type": "object",
          "required": ["backend", "model"],
          "properties": {
            "backend": { "enum": ["codex", "composer", "claude"] },
            "model": { "type": "string", "minLength": 1 }
          },
          "additionalProperties": false
        },
        "fallback_of": { "type": "string", "minLength": 1 },
        "routingShadow": { "type": "object" },
        "routing_shadow_error": { "type": ["string", "null"] }
      },
      "additionalProperties": false
    }
  }
}
