{
  "contract": "orchestrator-routing-trace/v2",
  "schema": 2,
  "timestamp": "2026-07-11T00:00:03.000Z",
  "status": "completed",
  "route": {
    "requested_public_alias": null,
    "requested_alias_kind": null,
    "canonical_capability_route": "explore.read-only.v1"
  },
  "models": {
    "requested": "opus-4.8",
    "candidate": "opus-4.8",
    "attempted": "opus-4.8",
    "selected": "opus-4.8"
  },
  "serving": {
    "provider": "Anthropic",
    "provider_model_id": "opus-4.8",
    "transport_backend": "claude",
    "adapter_id": "claude-code",
    "adapter_version": "1",
    "stable_id": "opus-4.8"
  },
  "traversal": {
    "candidate_index": 1,
    "attempt_index": 0,
    "stack_size": 2,
    "traversal_id": "trav-fallback"
  },
  "failure": {
    "normalized_class": null,
    "detail": null,
    "fallback_source": null,
    "fallback_destination": null,
    "fallback_reason": null,
    "terminal_reason": null
  },
  "authorization": {
    "override_requested": false,
    "override_applied": false,
    "explicit_parent_escalation": false,
    "sol_authorized": false
  },
  "lineage": {
    "root_run_id": "run-outage-1",
    "parent_run_id": "run-outage-1",
    "run_id": "run-fallback-1",
    "task_id": null,
    "depth": 1,
    "scheduler_id": null
  },
  "worktree": {
    "checkout_id": "abc123def456"
  },
  "versions": {
    "policy": "candidate-stacks/v1",
    "budget_policy": "budget-limits/v1",
    "registry": 1,
    "capability_routes": 1,
    "routing_shadow": 1,
    "routing_trace": 2
  },
  "budgets": {
    "root": {
      "token": { "allocated": 2000000, "consumed": 90, "remaining": 1999910 },
      "wall_time_ms": { "allocated": 3600000, "consumed": 5000, "remaining": 3595000 },
      "call": { "allocated": 25, "consumed": 2, "remaining": 23 },
      "cost": { "allocated": 10, "consumed": 1, "remaining": 9, "measurement": "unknown" },
      "concurrency": { "allocated": 3, "consumed": 1, "remaining": 2 }
    },
    "dispatch": {
      "token": { "allocated": 400000, "consumed": 90, "remaining": 399910 },
      "wall_time_ms": { "allocated": 900000, "consumed": 5000, "remaining": 895000 },
      "call": { "allocated": 1, "consumed": 1, "remaining": 0 },
      "cost": { "allocated": 2.5, "consumed": 1, "remaining": 1.5, "measurement": "unknown" },
      "concurrency": { "allocated": 1, "consumed": 1, "remaining": 0 }
    }
  },
  "legacy": {
    "schema": 4,
    "run_id": "run-fallback-1",
    "timestamp": "2026-07-11T00:00:03.000Z",
    "backend": "claude",
    "mode": "analyze",
    "model": "opus-4.8",
    "sandbox": "read-only",
    "project": "abc123def456",
    "label": "W-000074-fallback",
    "task_class": "feature",
    "route_rationale": "availability fallback explore",
    "duration_ms": 5000,
    "status": "completed",
    "exit_code": 0,
    "changed_files": 0,
    "tokens": {
      "input_tokens": 50,
      "cached_input_tokens": null,
      "output_tokens": 40,
      "total_tokens": 90
    },
    "budget": null,
    "error": null,
    "outcome": "accepted",
    "fallback_of": "run-outage-1"
  }
}
