{
  "contract": "orchestrator-routing-trace/v2",
  "schema": 2,
  "timestamp": "2026-07-11T00:00:02.000Z",
  "status": "error",
  "route": {
    "requested_public_alias": null,
    "requested_alias_kind": null,
    "canonical_capability_route": "implement.workspace-write.v1"
  },
  "models": {
    "requested": "gpt-5.6-terra",
    "candidate": null,
    "attempted": "gpt-5.6-terra",
    "selected": "gpt-5.6-terra"
  },
  "serving": {
    "provider": "OpenAI",
    "provider_model_id": "gpt-5.6-terra",
    "transport_backend": "codex",
    "adapter_id": "codex-cli",
    "adapter_version": "1",
    "stable_id": "gpt-5.6-terra"
  },
  "traversal": {
    "candidate_index": 0,
    "attempt_index": 0,
    "stack_size": 1,
    "traversal_id": "trav-outage"
  },
  "failure": {
    "normalized_class": "backend_unavailable",
    "detail": "usage limit exceeded",
    "fallback_source": "codex",
    "fallback_destination": "claude",
    "fallback_reason": "usage_limit",
    "terminal_reason": "outage"
  },
  "authorization": {
    "override_requested": false,
    "override_applied": false,
    "explicit_parent_escalation": false,
    "sol_authorized": false
  },
  "lineage": {
    "root_run_id": "run-outage-1",
    "parent_run_id": null,
    "run_id": "run-outage-1",
    "task_id": null,
    "depth": 0,
    "scheduler_id": null
  },
  "worktree": {
    "checkout_id": "abc123def456"
  },
  "versions": {
    "policy": "candidate-stacks/v1",
    "budget_policy": "budget-limits/v1",
    "registry": 1,
    "capability_routes": 1,
    "routing_shadow": 1,
    "routing_trace": 2
  },
  "budgets": {
    "root": {
      "token": { "allocated": 2000000, "consumed": 0, "remaining": 2000000 },
      "wall_time_ms": { "allocated": 3600000, "consumed": 800, "remaining": 3599200 },
      "call": { "allocated": 25, "consumed": 1, "remaining": 24 },
      "cost": { "allocated": 10, "consumed": 0, "remaining": 10, "measurement": "unknown" },
      "concurrency": { "allocated": 3, "consumed": 1, "remaining": 2 }
    },
    "dispatch": {
      "token": { "allocated": 400000, "consumed": 0, "remaining": 400000 },
      "wall_time_ms": { "allocated": 900000, "consumed": 800, "remaining": 899200 },
      "call": { "allocated": 1, "consumed": 1, "remaining": 0 },
      "cost": { "allocated": 2.5, "consumed": 0, "remaining": 2.5, "measurement": "unknown" },
      "concurrency": { "allocated": 1, "consumed": 1, "remaining": 0 }
    }
  },
  "legacy": {
    "schema": 4,
    "run_id": "run-outage-1",
    "timestamp": "2026-07-11T00:00:02.000Z",
    "backend": "codex",
    "mode": "implement",
    "model": "gpt-5.6-terra",
    "sandbox": "workspace-write",
    "project": "abc123def456",
    "label": "W-000074-outage",
    "task_class": "feature",
    "route_rationale": "primary backend unavailable",
    "duration_ms": 800,
    "status": "error",
    "exit_code": 7,
    "changed_files": null,
    "tokens": null,
    "budget": null,
    "error": "usage limit exceeded",
    "effort": "high",
    "failure_class": "backend_unavailable",
    "outage_reason": "usage_limit",
    "fallback": {
      "backend": "claude",
      "model": "opus-4.8"
    },
    "routingShadow": {
      "candidate": "composer-implement",
      "selected": "codex-implement",
      "shadow_error": null
    },
    "routing_shadow_error": null
  }
}
